Theme 3 — Social Dynamics,,,
Subtheme,Case,Quote,DeepL Translation
3.1 Positive Peer Perception,CS2,"Olha, eu acho que eles percebessem de maneira positiva assim, porque é para mim uma coisa que ajudou é que essa situação de ter que trazer essa coisa de atualizar automaticamente o artefato era uma coisa que eu estava muito resistente.","Look, I think they saw it in a positive light, because for me, one thing that helped was that I was very resistant to the idea of having to automatically update the device."
,CS2,"Até porque assim, talvez modelando o canva e trazendo ele para o pessoal da empresa, eventualmente consiga convencer que é importante trazer um oncologista para dentro do projeto de melhoria do chatbot.","Especially because, by modeling the canvas and presenting it to the company staff, you may eventually convince them that it is important to bring an oncologist into the chatbot improvement project."
,CS4,"Não, [a reação dos meus colegas] não iria interferir na minha vontade de usar [o Canva].","No, [my colleagues' reaction] would not interfere with my desire to use [Canva]."
,CS5,"It's always extra work and no one is excited about extra work, but I think asking the questions you were asking has value, yes. So not electively, but as part of a process that someone makes them go through, yeah.",